{
  "event_id": "11111111-1111-4111-8111-111111111111",
  "event_type": "order.created",
  "version": 1,
  "correlation_id": "22222222-2222-4222-8222-222222222222",
  "occurred_at": "2026-09-24T12:00:00Z",
  "payload": {
    "order_id": "22222222-2222-4222-8222-222222222222",
    "customer_id": "33333333-3333-4333-8333-333333333333",
    "items": [
      {
        "product_id": "44444444-4444-4444-8444-444444444444",
        "quantity": 1,
        "unit_price": 10.0
      }
    ],
    "total_amount": 10.0,
    "simulate": { "payment": "approve", "stock": "reserve" }
  }
}
